{
  "sessionId": "ses_01HZX9Q7QF0F5S6YCC3H3WZ6JH",
  "status": "active",
  "currentStep": 2,
  "createdAt": "2026-04-05T10:00:00Z",
  "updatedAt": "2026-04-05T10:08:12Z",
  "files": [
    {
      "fileId": "fil_01HZXA0Q8A8F9M9M6Q5Q9E8YJ1",
      "displayName": "pricing-deck.pdf",
      "mimeType": "application/pdf",
      "sizeBytes": 2483621,
      "sha256": "9a1ca6d0bc336cae95c519f84400f740f2f3802f0225ed8c9444f511693159ef",
      "sourceType": "primary",
      "uploadStatus": "ready"
    },
    {
      "fileId": "fil_01HZXA2R8AXJ4H7G3Q1D8E2YB3",
      "displayName": "brand-guide.pdf",
      "mimeType": "application/pdf",
      "sizeBytes": 932114,
      "sha256": "cad592705cf8f26dff8245f5f66f490451f9f8f7f985e9976a193871918d3fdb",
      "sourceType": "reference",
      "originalUri": "file:///Users/example/brand-guide.pdf",
      "uploadStatus": "ready"
    }
  ],
  "checkpoints": {
    "upload": {
      "status": "ready",
      "updatedAt": "2026-04-05T10:08:12Z"
    },
    "pageMap": {
      "status": "in_progress",
      "updatedAt": "2026-04-05T10:08:12Z"
    },
    "settings": {
      "status": "not_started",
      "updatedAt": "2026-04-05T10:08:12Z"
    },
    "review": {
      "status": "not_started",
      "updatedAt": "2026-04-05T10:08:12Z"
    },
    "preview": {
      "status": "not_started",
      "updatedAt": "2026-04-05T10:08:12Z"
    },
    "complete": {
      "status": "not_started",
      "updatedAt": "2026-04-05T10:08:12Z"
    }
  }
}
